{
  "N": "1099507433251",
  "algorithm_version": "pgs_rsa_endpoint_resolver_v3.1",
  "bits": 40,
  "case_id": "rsa_v2_40bit_static_001",
  "center": "1048573",
  "closure_status": "endpoint_class_by_reciprocal_deadline_signature_correction",
  "content_hash": "sha256:71dab0bbd2094c66b3e00f650a2f233929a508933de37a5eeff04ff86ed89e42",
  "corrected_lower_certificate": {
    "active_count": 290,
    "anchor": "1048559",
    "candidate_bound": 4096,
    "carrier_d": 4,
    "carrier_w": "1048561",
    "closed_offsets_before_q": [
      2,
      8,
      18,
      20,
      32,
      38,
      44,
      48,
      60,
      62,
      72,
      78,
      80,
      84,
      90,
      92,
      98,
      104,
      108,
      110,
      114,
      120,
      128,
      132,
      134,
      138,
      140,
      152,
      164,
      168,
      170,
      174,
      180,
      182,
      188,
      192,
      194,
      198,
      204,
      210,
      212,
      218,
      222,
      228,
      230,
      242,
      252,
      254,
      258,
      260,
      264,
      272,
      282,
      284,
      290,
      294,
      300,
      302,
      312,
      314,
      320,
      324,
      342,
      344,
      348,
      354,
      362,
      368,
      372,
      374,
      378,
      380,
      384,
      390,
      392,
      398,
      402,
      408,
      410,
      414,
      420,
      422,
      428,
      434,
      438,
      440,
      444,
      450,
      458,
      462,
      468,
      470,
      474,
      482,
      488,
      494,
      500,
      510,
      512,
      522,
      524,
      528,
      540,
      548,
      552,
      554,
      560,
      564,
      588,
      590,
      594,
      600,
      602,
      608,
      620,
      630,
      632,
      638,
      644,
      648,
      650,
      654,
      662,
      672,
      674,
      678,
      684,
      690,
      692,
      698,
      702,
      708,
      710,
      714,
      720,
      728,
      732,
      734,
      740,
      744,
      750,
      752,
      758,
      762,
      764,
      768,
      770,
      782,
      788,
      792,
      794,
      798,
      800,
      804,
      810,
      812,
      818,
      822,
      824,
      830,
      834,
      840,
      842,
      848,
      852,
      858,
      860,
      864,
      872,
      882,
      884,
      888,
      890,
      894,
      902,
      908,
      918,
      930,
      932,
      942,
      944,
      948,
      954,
      962,
      972,
      980,
      984,
      992,
      998,
      1002,
      1004,
      1008,
      1014,
      1020,
      1022,
      1028,
      1032,
      1034,
      1038,
      1050,
      1058,
      1062,
      1068,
      1070,
      1074,
      1082,
      1088,
      1092,
      1094,
      1098,
      1100,
      1110,
      1112,
      1130,
      1134,
      1140,
      1142,
      1152,
      1154,
      1160,
      1164,
      1170,
      1172,
      1178,
      1182,
      1184,
      1190,
      1194,
      1200,
      1202,
      1208,
      1212,
      1218,
      1220,
      1224,
      1230,
      1238,
      1242,
      1244,
      1248,
      1254,
      1260,
      1272,
      1280,
      1292,
      1308,
      1310,
      1314,
      1320,
      1322,
      1328,
      1334,
      1344,
      1350,
      1352,
      1358,
      1362,
      1364,
      1368,
      1370,
      1374,
      1380,
      1388,
      1392,
      1398,
      1400,
      1410,
      1412,
      1422,
      1424,
      1428,
      1430,
      1434,
      1442,
      1448,
      1458,
      1460,
      1464,
      1470,
      1478,
      1484,
      1488,
      1490,
      1500,
      1502,
      1508,
      1512,
      1514,
      1518,
      1530,
      1532,
      1538,
      1542,
      1544,
      1548,
      1550,
      1554,
      1560,
      1562,
      1568,
      1572,
      1574,
      1578,
      1584,
      1590,
      1598,
      1602,
      1604,
      1614,
      1620,
      1622,
      1628,
      1634,
      1640,
      1644,
      1650,
      1652,
      1658,
      1662,
      1664,
      1668,
      1688,
      1692,
      1698,
      1700,
      1704,
      1710,
      1712,
      1718,
      1724,
      1728,
      1730,
      1734,
      1740,
      1742,
      1752,
      1754,
      1760,
      1770,
      1782,
      1784,
      1788,
      1794,
      1800,
      1802,
      1812,
      1814,
      1818,
      1820,
      1824,
      1830,
      1838,
      1842,
      1844,
      1848,
      1850,
      1854,
      1860,
      1868,
      1874,
      1880,
      1884,
      1902,
      1904,
      1908,
      1910,
      1920,
      1922,
      1928,
      1932,
      1934,
      1938,
      1940,
      1952,
      1958,
      1962,
      1968,
      1970,
      1974,
      1980,
      1982,
      1988,
      1992,
      1994,
      1998,
      2000,
      2010,
      2012,
      2018,
      2022,
      2024,
      2028,
      2030,
      2040,
      2042,
      2048,
      2054,
      2058,
      2060,
      2064,
      2070,
      2078,
      2082,
      2084,
      2088,
      2090,
      2094,
      2100,
      2102,
      2108,
      2112,
      2114,
      2118,
      2120,
      2124,
      2130,
      2132,
      2138,
      2142,
      2144,
      2148,
      2150,
      2160,
      2162,
      2172,
      2190,
      2192,
      2198,
      2202,
      2204,
      2208,
      2220,
      2228,
      2232,
      2234,
      2238,
      2240,
      2244,
      2250,
      2262,
      2264,
      2268,
      2270,
      2274,
      2280,
      2282,
      2288,
      2298,
      2300,
      2304,
      2310,
      2312,
      2318,
      2322,
      2324,
      2330,
      2334,
      2348,
      2352,
      2358,
      2360,
      2364,
      2370,
      2372,
      2378,
      2382,
      2384,
      2388,
      2394,
      2400,
      2408,
      2412,
      2414,
      2420,
      2424,
      2430,
      2432,
      2442,
      2454,
      2462,
      2472,
      2474,
      2478,
      2480,
      2484,
      2490,
      2498,
      2502,
      2504,
      2508,
      2514,
      2528,
      2532,
      2534,
      2538,
      2540,
      2544,
      2550,
      2552,
      2558,
      2562,
      2564,
      2568,
      2570,
      2574,
      2582,
      2600,
      2604,
      2610,
      2612,
      2624,
      2628,
      2630,
      2634,
      2640,
      2642,
      2648,
      2652,
      2654,
      2658,
      2660,
      2664,
      2670,
      2672,
      2678,
      2682,
      2684,
      2690,
      2694,
      2700,
      2702,
      2708,
      2712,
      2714,
      2720,
      2730,
      2738,
      2744,
      2748,
      2750,
      2762,
      2768,
      2772,
      2778,
      2780,
      2784,
      2790,
      2792,
      2798,
      2802,
      2804,
      2808,
      2810,
      2820,
      2822,
      2828,
      2832,
      2834,
      2840,
      2844,
      2852,
      2862,
      2868,
      2870,
      2874,
      2880,
      2882,
      2888,
      2892,
      2894,
      2898,
      2904,
      2918,
      2924,
      2928,
      2930,
      2934,
      2942,
      2952,
      2954,
      2958,
      2960,
      2964,
      2970,
      2972,
      2978,
      2982,
      2988,
      3002,
      3008,
      3014,
      3018,
      3020,
      3024,
      3030,
      3038,
      3044,
      3050,
      3054,
      3068,
      3072,
      3074,
      3078,
      3092,
      3098,
      3102,
      3108,
      3110,
      3114,
      3120,
      3122,
      3128,
      3132,
      3134,
      3140,
      3144,
      3152,
      3162,
      3164,
      3168,
      3170,
      3174,
      3180,
      3182,
      3192,
      3194,
      3198,
      3210,
      3212,
      3218,
      3224,
      3228,
      3234,
      3240,
      3242,
      3248,
      3254,
      3258,
      3264,
      3272,
      3278,
      3282,
      3284,
      3294,
      3300,
      3302,
      3308,
      3312,
      3314,
      3318,
      3324,
      3332,
      3338,
      3342,
      3348,
      3350,
      3360,
      3362,
      3372,
      3374,
      3378,
      3380,
      3384,
      3392,
      3404,
      3408,
      3410,
      3414,
      3422,
      3434,
      3438,
      3440,
      3444,
      3450,
      3452,
      3458,
      3462,
      3464,
      3470,
      3474,
      3488,
      3492,
      3494,
      3498,
      3500,
      3510,
      3512,
      3518,
      3522,
      3528,
      3530,
      3534,
      3542,
      3548,
      3554,
      3558,
      3564,
      3570,
      3572,
      3584,
      3588,
      3590,
      3594,
      3600,
      3602,
      3608,
      3612,
      3614,
      3618,
      3624,
      3630,
      3632,
      3642,
      3648,
      3650,
      3654,
      3660,
      3668,
      3674,
      3680,
      3684,
      3690,
      3692,
      3698,
      3702,
      3704,
      3708,
      3714,
      3732,
      3734,
      3738,
      3744,
      3752,
      3758,
      3764,
      3780,
      3782,
      3788,
      3792,
      3794,
      3798,
      3800,
      3804,
      3810,
      3812,
      3818,
      3822,
      3824,
      3828,
      3830,
      3834,
      3840,
      3842,
      3848,
      3852,
      3860,
      3864,
      3870,
      3882,
      3884,
      3888,
      3890,
      3894,
      3902,
      3908,
      3912,
      3918,
      3924,
      3932,
      3938,
      3942,
      3944,
      3948,
      3950,
      3954,
      3960,
      3962,
      3968,
      3980,
      3984,
      3990,
      3998,
      4010,
      4020,
      4022,
      4028,
      4032,
      4034,
      4038,
      4040,
      4044,
      4052,
      4058,
      4062,
      4064,
      4068,
      4074,
      4080,
      4082,
      4088,
      4092,
      4094
    ],
    "gap_offset": 12,
    "lock_carrier_d": 4,